<?xml version="1.0" encoding="utf-8" ?>
<!DOCTYPE Animations_Center SYSTEM "../DTDs/Animations_Center.dtd">
<Animations_Center>
	<Style>Unarmed</Style><!-- Unarmed|Melee|Distant  ONLY !!-->
	<Type>Unarmed</Type><!-- Unarmed|Sword|Bow  ONLY !!-->
	<Stop_Animation_Filename>Human_Unarmed_Stop.xml</Stop_Animation_Filename>
	<Walk_Animation_Filename>Human_Unarmed_Walk.xml</Walk_Animation_Filename>
	<Run_Animation_Filename>Human_Unarmed_Run.xml</Run_Animation_Filename>
	<Attack_Animation_Filename>Human_Unarmed_Attack.xml</Attack_Animation_Filename>
	<Death_Animation_Filename>Human_Unarmed_Death.xml</Death_Animation_Filename>
	<Hit_Animation_Filename>Human_Unarmed_Hit.xml</Hit_Animation_Filename>
</Animations_Center>
